{
 "bounds": {
  "S6.n.A": [
   0.0,
   null
  ],
  "S6.n.B": [
   0.0,
   null
  ],
  "S6.n.C": [
   0.0,
   null
  ]
 },
 "column_scales": {
  "S1.P": 100000.0,
  "S1.T": 100.0,
  "S1.n.A": 3.0,
  "S1.n.B": 3.0,
  "S1.n.C": 3.0,
  "S2.P": 100000.0,
  "S2.T": 100.0,
  "S2.n.A": 3.0,
  "S2.n.B": 3.0,
  "S2.n.C": 3.0,
  "S3.L": 3.0,
  "S3.P": 100000.0,
  "S3.T": 100.0,
  "S3.V": 3.0,
  "S3.liq.A": 3.0,
  "S3.liq.B": 3.0,
  "S3.liq.C": 3.0,
  "S3.n.A": 3.0,
  "S3.n.B": 3.0,
  "S3.n.C": 3.0,
  "S3.vap.A": 3.0,
  "S3.vap.B": 3.0,
  "S3.vap.C": 3.0,
  "S4.N": 3.0,
  "S4.P": 100000.0,
  "S4.T": 100.0,
  "S4.n.A": 3.0,
  "S4.n.B": 3.0,
  "S4.n.C": 3.0,
  "S5.N": 3.0,
  "S5.P": 100000.0,
  "S5.T": 100.0,
  "S5.n.A": 3.0,
  "S5.n.B": 3.0,
  "S5.n.C": 3.0,
  "S6.P": 100000.0,
  "S6.T": 100.0,
  "S6.n.A": 3.0,
  "S6.n.B": 3.0,
  "S6.n.C": 3.0,
  "S7.P": 100000.0,
  "S7.T": 100.0,
  "S7.n.A": 3.0,
  "S7.n.B": 3.0,
  "S7.n.C": 3.0,
  "U-FLASH.Q": 100000.0,
  "U-HEAT.Q": 100000.0
 },
 "constants_sha256": "4054a86c0dd9fae56ff0462e137966622a68513bf4ba7d0a84934ffa4a07656d",
 "eliminated_rows": [
  {
   "constant_mismatch": 0.0,
   "equals": [
    [
     "U-HEAT:HEAT-pressure",
     1
    ],
    [
     "U-MIX:MIX-pressure:0",
     -1
    ],
    [
     "U-FEED:FEED-P",
     1
    ]
   ],
   "row_id": "U-FLASH:FLASH-P:inlet",
   "tolerance": 0.01
  },
  {
   "constant_mismatch": 0.0,
   "equals": [
    [
     "U-MIX:MIX-pressure:1",
     1
    ],
    [
     "U-MIX:MIX-pressure:0",
     -1
    ],
    [
     "U-FEED:FEED-P",
     1
    ],
    [
     "U-FLASH:FLASH-P:liquid",
     -1
    ]
   ],
   "row_id": "U-SPLIT:SPLIT-P:recycle",
   "tolerance": 0.01
  }
 ],
 "estimates": {
  "inner_dimension": 44,
  "jacobian_nnz": 170
 },
 "initializer_chain": [
  "SYN-001-tear-init-v2"
 ],
 "inner_row_ids": [
  "U-FEED:FEED-n:A",
  "U-FEED:FEED-n:B",
  "U-FEED:FEED-n:C",
  "U-FEED:FEED-T",
  "U-FEED:FEED-P",
  "U-MIX:MIX-mole:A",
  "U-MIX:MIX-mole:B",
  "U-MIX:MIX-mole:C",
  "U-MIX:MIX-energy",
  "U-MIX:MIX-pressure:0",
  "U-MIX:MIX-pressure:1",
  "U-HEAT:HEAT-mole:A",
  "U-HEAT:HEAT-mole:B",
  "U-HEAT:HEAT-mole:C",
  "U-HEAT:HEAT-T",
  "U-HEAT:HEAT-pressure",
  "U-HEAT:HEAT-duty",
  "U-HEAT:HEAT-equilibrium:A",
  "U-HEAT:split:A",
  "U-HEAT:HEAT-equilibrium:B",
  "U-HEAT:split:B",
  "U-HEAT:HEAT-equilibrium:C",
  "U-HEAT:split:C",
  "U-HEAT:Vdef",
  "U-HEAT:Ldef",
  "U-FLASH:FLASH-mole:A",
  "U-FLASH:FLASH-equilibrium:A",
  "U-FLASH:FLASH-mole:B",
  "U-FLASH:FLASH-equilibrium:B",
  "U-FLASH:FLASH-mole:C",
  "U-FLASH:FLASH-equilibrium:C",
  "U-FLASH:FLASH-T:vapor",
  "U-FLASH:FLASH-T:liquid",
  "U-FLASH:FLASH-P:vapor",
  "U-FLASH:FLASH-P:liquid",
  "U-FLASH:FLASH-duty",
  "U-FLASH:Ndef:vapor",
  "U-FLASH:Ndef:liquid",
  "U-SPLIT:SPLIT-purge:A",
  "U-SPLIT:SPLIT-purge:B",
  "U-SPLIT:SPLIT-purge:C",
  "U-SPLIT:SPLIT-T:recycle",
  "U-SPLIT:SPLIT-T:purge",
  "U-SPLIT:SPLIT-P:purge"
 ],
 "inner_variable_ids": [
  "S1.n.A",
  "S1.n.B",
  "S1.n.C",
  "S1.T",
  "S1.P",
  "S2.n.A",
  "S2.n.B",
  "S2.n.C",
  "S2.T",
  "S2.P",
  "S3.n.A",
  "S3.n.B",
  "S3.n.C",
  "S3.T",
  "S3.P",
  "S4.n.A",
  "S4.n.B",
  "S4.n.C",
  "S4.T",
  "S4.P",
  "S5.n.A",
  "S5.n.B",
  "S5.n.C",
  "S5.T",
  "S5.P",
  "S6.T",
  "S6.P",
  "S7.n.A",
  "S7.n.B",
  "S7.n.C",
  "S7.T",
  "S7.P",
  "U-HEAT.Q",
  "S3.vap.A",
  "S3.vap.B",
  "S3.vap.C",
  "S3.liq.A",
  "S3.liq.B",
  "S3.liq.C",
  "S3.V",
  "S3.L",
  "U-FLASH.Q",
  "S4.N",
  "S5.N"
 ],
 "model_version": "SYN001-fs1-syn001-4e4c37cc8054-44f894ff62f9@73a8950bc0038a967ddf8cf7f5d1d07695ff6c230e1965ff898fe8e02ef67769",
 "plan_id": "SYN-001-SYN001-fs1-syn001-4e4c37cc8054-44f894ff62f9-SYN-001-K03",
 "policy_id": "SYN-001-K03",
 "row_scales": {
  "U-FEED:FEED-P": 100000.0,
  "U-FEED:FEED-T": 100.0,
  "U-FEED:FEED-n:A": 3.0,
  "U-FEED:FEED-n:B": 3.0,
  "U-FEED:FEED-n:C": 3.0,
  "U-FLASH:FLASH-P:inlet": 100000.0,
  "U-FLASH:FLASH-P:liquid": 100000.0,
  "U-FLASH:FLASH-P:vapor": 100000.0,
  "U-FLASH:FLASH-T:liquid": 100.0,
  "U-FLASH:FLASH-T:vapor": 100.0,
  "U-FLASH:FLASH-duty": 100000.0,
  "U-FLASH:FLASH-equilibrium:A": 9.0,
  "U-FLASH:FLASH-equilibrium:B": 9.0,
  "U-FLASH:FLASH-equilibrium:C": 9.0,
  "U-FLASH:FLASH-mole:A": 3.0,
  "U-FLASH:FLASH-mole:B": 3.0,
  "U-FLASH:FLASH-mole:C": 3.0,
  "U-FLASH:Ndef:liquid": 3.0,
  "U-FLASH:Ndef:vapor": 3.0,
  "U-HEAT:HEAT-T": 100.0,
  "U-HEAT:HEAT-duty": 100000.0,
  "U-HEAT:HEAT-equilibrium:A": 9.0,
  "U-HEAT:HEAT-equilibrium:B": 9.0,
  "U-HEAT:HEAT-equilibrium:C": 9.0,
  "U-HEAT:HEAT-mole:A": 3.0,
  "U-HEAT:HEAT-mole:B": 3.0,
  "U-HEAT:HEAT-mole:C": 3.0,
  "U-HEAT:HEAT-pressure": 100000.0,
  "U-HEAT:Ldef": 3.0,
  "U-HEAT:Vdef": 3.0,
  "U-HEAT:split:A": 3.0,
  "U-HEAT:split:B": 3.0,
  "U-HEAT:split:C": 3.0,
  "U-MIX:MIX-energy": 100000.0,
  "U-MIX:MIX-mole:A": 3.0,
  "U-MIX:MIX-mole:B": 3.0,
  "U-MIX:MIX-mole:C": 3.0,
  "U-MIX:MIX-pressure:0": 100000.0,
  "U-MIX:MIX-pressure:1": 100000.0,
  "U-SPLIT:SPLIT-P:purge": 100000.0,
  "U-SPLIT:SPLIT-P:recycle": 100000.0,
  "U-SPLIT:SPLIT-T:purge": 100.0,
  "U-SPLIT:SPLIT-T:recycle": 100.0,
  "U-SPLIT:SPLIT-purge:A": 3.0,
  "U-SPLIT:SPLIT-purge:B": 3.0,
  "U-SPLIT:SPLIT-purge:C": 3.0,
  "U-SPLIT:SPLIT-recycle:A": 3.0,
  "U-SPLIT:SPLIT-recycle:B": 3.0,
  "U-SPLIT:SPLIT-recycle:C": 3.0
 },
 "scale_provenance": "docs/derivations/SYN-001.md \u00a79 (registered physical nominals; benchmarks/registry.yaml `scales`), assigned by declared quantity kind",
 "signature_units": [
  "U-FLASH"
 ],
 "tear_row_ids": [
  "U-SPLIT:SPLIT-recycle:A",
  "U-SPLIT:SPLIT-recycle:B",
  "U-SPLIT:SPLIT-recycle:C"
 ],
 "tear_variable_ids": [
  "S6.n.A",
  "S6.n.B",
  "S6.n.C"
 ]
}
