{"bounds":{"S1.n.A":[0,null],"S1.n.B":[0,null],"S1.n.C":[0,null],"S2.n.A":[0,null],"S2.n.B":[0,null],"S2.n.C":[0,null],"S3.L":[0,null],"S3.V":[0,null],"S3.liq.A":[0,null],"S3.liq.B":[0,null],"S3.liq.C":[0,null],"S3.n.A":[0,null],"S3.n.B":[0,null],"S3.n.C":[0,null],"S3.vap.A":[0,null],"S3.vap.B":[0,null],"S3.vap.C":[0,null],"S4.N":[0,null],"S4.n.A":[0,null],"S4.n.B":[0,null],"S4.n.C":[0,null],"S5.N":[0,null],"S5.n.A":[0,null],"S5.n.B":[0,null],"S5.n.C":[0,null],"S6.n.A":[0,null],"S6.n.B":[0,null],"S6.n.C":[0,null],"S7.n.A":[0,null],"S7.n.B":[0,null],"S7.n.C":[0,null]},"column_scales":{"S1.P":100000,"S1.T":100,"S1.n.A":3,"S1.n.B":3,"S1.n.C":3,"S2.P":100000,"S2.T":100,"S2.n.A":3,"S2.n.B":3,"S2.n.C":3,"S3.L":3,"S3.P":100000,"S3.T":100,"S3.V":3,"S3.liq.A":3,"S3.liq.B":3,"S3.liq.C":3,"S3.n.A":3,"S3.n.B":3,"S3.n.C":3,"S3.vap.A":3,"S3.vap.B":3,"S3.vap.C":3,"S4.N":3,"S4.P":100000,"S4.T":100,"S4.n.A":3,"S4.n.B":3,"S4.n.C":3,"S5.N":3,"S5.P":100000,"S5.T":100,"S5.n.A":3,"S5.n.B":3,"S5.n.C":3,"S6.P":100000,"S6.T":100,"S6.n.A":3,"S6.n.B":3,"S6.n.C":3,"S7.P":100000,"S7.T":100,"S7.n.A":3,"S7.n.B":3,"S7.n.C":3,"U-HEAT.Q":100000,"U-PHF.Q":100000},"constants_sha256":"563f0a9e72ea4dbff5862282af5607b78abf4035b5f3564b4d20d93aee595db4","eliminated_rows":[{"constant_mismatch":0,"equals":[["U-HEAT:HEAT-pressure",-1],["U-MIX:MIX-pressure:1",1],["U-PHF:PHF-pressure:liquid",-1]],"row_id":"U-SPLIT:SPLIT-P:recycle","tolerance":0.01}],"estimates":{"inner_dimension":47,"jacobian_nnz":172},"initializer_chain":["user_guess","sequential_pre_solve"],"inner_row_ids":["U-FEED:FEED-n:A","U-FEED:FEED-n:B","U-FEED:FEED-n:C","U-FEED:FEED-T","U-FEED:FEED-P","U-MIX:MIX-mole:A","U-MIX:MIX-mole:B","U-MIX:MIX-mole:C","U-MIX:MIX-energy","U-MIX:MIX-pressure:0","U-MIX:MIX-pressure:1","U-HEAT:HEAT-mole:A","U-HEAT:HEAT-mole:B","U-HEAT:HEAT-mole:C","U-HEAT:HEAT-T","U-HEAT:HEAT-pressure","U-HEAT:HEAT-duty","U-HEAT:HEAT-equilibrium:A","U-HEAT:split:A","U-HEAT:HEAT-equilibrium:B","U-HEAT:split:B","U-HEAT:HEAT-equilibrium:C","U-HEAT:split:C","U-HEAT:Vdef","U-HEAT:Ldef","U-PHF:PHF-mole:A","U-PHF:PHF-mole:B","U-PHF:PHF-mole:C","U-PHF:PHF-equilibrium:A","U-PHF:PHF-equilibrium:B","U-PHF:PHF-equilibrium:C","U-PHF:PHF-T","U-PHF:PHF-pressure:vapor","U-PHF:PHF-pressure:liquid","U-PHF:PHF-duty","U-PHF:PHF-Q","U-PHF:Ndef:vapor","U-PHF:Ndef:liquid","U-SPLIT:SPLIT-recycle:A","U-SPLIT:SPLIT-purge:A","U-SPLIT:SPLIT-recycle:B","U-SPLIT:SPLIT-purge:B","U-SPLIT:SPLIT-recycle:C","U-SPLIT:SPLIT-purge:C","U-SPLIT:SPLIT-T:recycle","U-SPLIT:SPLIT-T:purge","U-SPLIT:SPLIT-P:purge"],"inner_variable_ids":["S1.n.A","S1.n.B","S1.n.C","S1.T","S1.P","S6.n.A","S6.n.B","S6.n.C","S6.T","S6.P","S2.n.A","S2.n.B","S2.n.C","S2.T","S2.P","S3.n.A","S3.n.B","S3.n.C","S3.T","S3.P","S4.n.A","S4.n.B","S4.n.C","S4.T","S4.P","S5.n.A","S5.n.B","S5.n.C","S5.T","S5.P","S7.n.A","S7.n.B","S7.n.C","S7.T","S7.P","U-HEAT.Q","S3.vap.A","S3.vap.B","S3.vap.C","S3.liq.A","S3.liq.B","S3.liq.C","S3.V","S3.L","U-PHF.Q","S4.N","S5.N"],"model_version":"FSR1-e3f2d5372330-syn001-4e4c37cc8054-44f894ff62f9@addb802638c91178f64c91c23f5992a7fc3563faca546ad246d1407d688c44e7","plan_id":"FSR1-e3f2d5372330-syn001-4e4c37cc8054-44f894ff62f9-T06-revision-v2-region0","policy_id":"T06-revision-v2","row_scales":{"U-FEED:FEED-P":100000,"U-FEED:FEED-T":100,"U-FEED:FEED-n:A":3,"U-FEED:FEED-n:B":3,"U-FEED:FEED-n:C":3,"U-HEAT:HEAT-T":100,"U-HEAT:HEAT-duty":100000,"U-HEAT:HEAT-equilibrium:A":9,"U-HEAT:HEAT-equilibrium:B":9,"U-HEAT:HEAT-equilibrium:C":9,"U-HEAT:HEAT-mole:A":3,"U-HEAT:HEAT-mole:B":3,"U-HEAT:HEAT-mole:C":3,"U-HEAT:HEAT-pressure":100000,"U-HEAT:Ldef":3,"U-HEAT:Vdef":3,"U-HEAT:split:A":3,"U-HEAT:split:B":3,"U-HEAT:split:C":3,"U-MIX:MIX-energy":100000,"U-MIX:MIX-mole:A":3,"U-MIX:MIX-mole:B":3,"U-MIX:MIX-mole:C":3,"U-MIX:MIX-pressure:0":100000,"U-MIX:MIX-pressure:1":100000,"U-PHF:Ndef:liquid":3,"U-PHF:Ndef:vapor":3,"U-PHF:PHF-Q":100000,"U-PHF:PHF-T":100,"U-PHF:PHF-duty":100000,"U-PHF:PHF-equilibrium:A":9,"U-PHF:PHF-equilibrium:B":9,"U-PHF:PHF-equilibrium:C":9,"U-PHF:PHF-mole:A":3,"U-PHF:PHF-mole:B":3,"U-PHF:PHF-mole:C":3,"U-PHF:PHF-pressure:liquid":100000,"U-PHF:PHF-pressure:vapor":100000,"U-SPLIT:SPLIT-P:purge":100000,"U-SPLIT:SPLIT-T:purge":100,"U-SPLIT:SPLIT-T:recycle":100,"U-SPLIT:SPLIT-purge:A":3,"U-SPLIT:SPLIT-purge:B":3,"U-SPLIT:SPLIT-purge:C":3,"U-SPLIT:SPLIT-recycle:A":3,"U-SPLIT:SPLIT-recycle:B":3,"U-SPLIT:SPLIT-recycle:C":3},"scale_provenance":"docs/derivations/SYN-001.md §9 (registered physical nominals; benchmarks/registry.yaml `scales`), assigned by declared quantity kind","signature_units":["U-HEAT","U-PHF"],"tear_row_ids":[],"tear_variable_ids":[]}